id,name,price,category,brand,description
1,TrailMaster X4 Tent,250.0,Tents,OutdoorLiving,"Unveiling the TrailMaster X4 Tent from OutdoorLiving, your home away from home for your next camping adventure. Crafted from durable polyester, this tent boasts a spacious interior perfect for four occupants. It ensures your dryness under drizzly skies thanks to its water-resistant construction, and the accompanying rainfly adds an extra layer of weather protection. It offers refreshing airflow and bug defence, courtesy of its mesh panels. Accessibility is not an issue with its multiple doors and interior pockets that keep small items tidy. Reflective guy lines grant better visibility at night, and the freestanding design simplifies setup and relocation. With the included carry bag, transporting this convenient abode becomes a breeze. Be it an overnight getaway or a week-long nature escapade, the TrailMaster X4 Tent provides comfort, convenience, and concord with the great outdoors. Comes with a two-year limited warranty to ensure customer satisfaction."
2,Adventurer Pro Backpack,90.0,Backpacks,HikeMate,"Venture into the wilderness with the HikeMate's Adventurer Pro Backpack! Uniquely designed with ergonomic comfort in mind, this backpack ensures a steadfast journey no matter the mileage. It boasts a generous 40L capacity wrapped up in durable nylon fabric ensuring its long-lasting performance on even the most rugged pursuits. It's meticulously fashioned with multiple compartments and pockets for organized storage, hydration system compatibility, and adjustable padded shoulder straps all in a lightweight construction. The added features of a sternum strap and hip belt enhance stability without compromising on comfort. The Adventurer Pro Backpack also prioritizes your safety with its reflective accents for when night falls. This buoyant beauty does more than carry your essentials; it carries the promise of a stress-free adventure!"
3,Summit Breeze Jacket,120.0,Hiking Clothing,MountainStyle,"Discover the joy of hiking with MountainStyle's Summit Breeze Jacket. This lightweight jacket is your perfect companion for outdoor adventures. Sporting a trail-ready, windproof design and a water-resistant fabric, it's ready to withstand any weather. The breathable polyester material and adjustable cuffs keep you comfortable, whether you're ascending a mountain or strolling through a park. And its sleek black color adds style to function. The jacket features a full-zip front closure, adjustable hood, and secure zippered pockets. Experience the comfort of its inner lining and the convenience of its packable design. Crafted for night trekkers too, the jacket has reflective accents for enhanced visibility. Rugged yet chic, the Summit Breeze Jacket is more than a hiking essential, it's the gear that inspires you to reach new heights. Choose adventure, choose the Summit Breeze Jacket."
4,TrekReady Hiking Boots,140.0,Hiking Footwear,TrekReady,"Introducing the TrekReady Hiking Boots - stepping up your hiking game, one footprint at a time! Crafted from leather, these stylistic Trailmates are made to last. TrekReady infuses durability with its reinforced stitching and toe protection, making sure your journey is never stopped short. Comfort? They have that covered too! The boots are a haven with their breathable materials, cushioned insole, with padded collar and tongue; all nestled neatly within their lightweight design. As they say, it's what's inside that counts - so inside you'll find a moisture-wicking lining that quarantines stank and keeps your feet fresh as that mountaintop breeze. Remember the fear of slippery surfaces? With these boots, you can finally tell it to 'take a hike'! Their shock-absorbing midsoles and excellent traction capabilities promise stability at your every step. Beautifully finished in a traditional lace-up system, every adventurer deserves a pair of TrekReady Hiking Boots. Hike more, worry less!"
5,BaseCamp Folding Table,60.0,Camping Tables,CampBuddy,"CampBuddy's BaseCamp Folding Table is an adventurer's best friend. Lightweight yet powerful, the table is a testament to fun-meets-function and will elevate any outing to new heights. Crafted from resilient, rust-resistant aluminum, the table boasts a generously sized 48 x 24 inches tabletop, perfect for meal times, games and more. The foldable design is a godsend for on-the-go explorers. Adjustable legs rise to the occasion to conquer uneven terrains and offer height versatility, while the built-in handle simplifies transportation. Additional features like non-slip feet, integrated cup holders and mesh pockets add a pinch of finesse. Quick to set up without the need for extra tools, this table is a silent yet indispensable sidekick during camping, picnics, and other outdoor events. Don't miss out on the opportunity to take your outdoor experiences to a new level with the BaseCamp Folding Table. Get yours today and embark on new adventures tomorrow! "
6,EcoFire Camping Stove,80.0,Camping Stoves,EcoFire,"Introducing EcoFire's Camping Stove, your ultimate companion for every outdoor adventure! This portable wonder is precision-engineered with a lightweight and compact design, perfect for capturing that spirit of wanderlust. Made from high-quality stainless steel, it promises durability and steadfast performance. This stove is not only fuel-efficient but also offers an easy, intuitive operation that ensures hassle-free cooking. Plus, it's flexible, accommodating a variety of cooking methods whether you're boiling, grilling, or simmering under the starry sky. Its stable construction, quick setup, and adjustable flame control make cooking a breeze, while safety features protect you from any potential mishaps. And did we mention it also includes an effective wind protector and a carry case for easy transportation? But that's not all! The EcoFire Camping Stove is eco-friendly, designed to minimize environmental impact. So get ready to enhance your camping experience and enjoy delicious outdoor feasts with this unique, versatile stove!"
